#Code;ENGLISH;FRENCH;GERMAN;;SPANISH;;;;;;;;;x;;;;;;;;;;;;;;;;;
EVTDESCDWRF.4;Rumour has it that the ruin of Uldaman, deep in the Badlands, has been unsealed... from within! Out from it march several armies of small, stout and bearded humanoids that many have taken to calling dwarves. Their destination, it seems, appears to be the mountains of Dun Morogh.;Rumour has it that the ruin of Uldaman, deep in the Badlands, has been unsealed... from within! Out from it march several armies of small, stout and bearded humanoids that many have taken to calling dwarves. Their destination, it seems, appears to be the mountains of Dun Morogh.;Rumour has it that the ruin of Uldaman, deep in the Badlands, has been unsealed... from within! Out from it march several armies of small, stout and bearded humanoids that many have taken to calling dwarves. Their destination, it seems, appears to be the mountains of Dun Morogh.;;Rumour has it that the ruin of Uldaman, deep in the Badlands, has been unsealed... from within! Out from it march several armies of small, stout and bearded humanoids that many have taken to calling dwarves. Their destination, it seems, appears to be the mountains of Dun Morogh.;;;;;;;;;x;;;;;;;;;;;;;;;;;
EVTOPTDWRF.4;I never heard of these stunted warriors before.;I never heard of these stunted warriors before.;I never heard of these stunted warriors before.;;I never heard of these stunted warriors before.;;;;;;;;;x;;;;;;;;;;;;;;;;;
EVTDESCDWRF.8;Finally, the last of the bearded invaders falls. What few survivors there are have scatter and gone to hiding. Maybe they'll regroup and make another attempt at your rule later, but for now the triumph is yours.;Finally, the last of the bearded invaders falls. What few survivors there are have scatter and gone to hiding. Maybe they'll regroup and make another attempt at your rule later, but for now the triumph is yours.;Finally, the last of the bearded invaders falls. What few survivors there are have scatter and gone to hiding. Maybe they'll regroup and make another attempt at your rule later, but for now the triumph is yours.;;Finally, the last of the bearded invaders falls. What few survivors there are have scatter and gone to hiding. Maybe they'll regroup and make another attempt at your rule later, but for now the triumph is yours.;;;;;;;;;x;;;;;;;;;;;;;;;;;
EVTOPTDWARF.8;Their invasion was cut short.;Their invasion was cut short.;Their invasion was cut short.;;Their invasion was cut short.;;;;;;;;;x;;;;;;;;;;;;;;;;;
EVTTITLEDWRF.9;Gnomeregan;Gnomeregan;Gnomeregan;;Gnomeregan;;;;;;;;;x;;;;;;;;;;;;;;;;;
EVTDESCDWRF.9;While exploring caves around the western mountains of Dun Morogh, a startling discovery was made! Tiny humanoids, calling themselves gnomes, have been found dwelling in them. Though not physically imposing and not as good as a dwarf when it comes to stonework, they seem to have an affinity for technology unlike anything seen before. The explorers also report they felt some sort of kinship with these gnomes, who were driven into hiding by the Ice Trolls that once dominated this region. Perhaps, they propose, we should give them some land to call their own?;While exploring caves around the western mountains of Dun Morogh, a startling discovery was made! Tiny humanoids, calling themselves gnomes, have been found dwelling in them. Though not physically imposing and not as good as a dwarf when it comes to stonework, they seem to have an affinity for technology unlike anything seen before. The explorers also report they felt some sort of kinship with these gnomes, who were driven into hiding by the Ice Trolls that once dominated this region. Perhaps, they propose, we should give them some land to call their own?;While exploring caves around the western mountains of Dun Morogh, a startling discovery was made! Tiny humanoids, calling themselves gnomes, have been found dwelling in them. Though not physically imposing and not as good as a dwarf when it comes to stonework, they seem to have an affinity for technology unlike anything seen before. The explorers also report they felt some sort of kinship with these gnomes, who were driven into hiding by the Ice Trolls that once dominated this region. Perhaps, they propose, we should give them some land to call their own?;;While exploring caves around the western mountains of Dun Morogh, a startling discovery was made! Tiny humanoids, calling themselves gnomes, have been found dwelling in them. Though not physically imposing and not as good as a dwarf when it comes to stonework, they seem to have an affinity for technology unlike anything seen before. The explorers also report they felt some sort of kinship with these gnomes, who were driven into hiding by the Ice Trolls that once dominated this region. Perhaps, they propose, we should give them some land to call their own?;;;;;;;;;x;;;;;;;;;;;;;;;;;
EVTOPTDWRF.9a;Yes. Let them have the region.;Yes. Let them have the region.;Yes. Let them have the region.;;Yes. Let them have the region.;;;;;;;;;x;;;;;;;;;;;;;;;;;
EVTOPTDWRF.9b;Absolutely not!;Absolutely not!;Absolutely not!;;Absolutely not!;;;;;;;;;x;;;;;;;;;;;;;;;;;
EVTDESCDWRF.13;Strange grey dragons have come to your aid against the bearded warriors who assault your lands. They do not tell you why, or really anything at all for that matter, but you are not exactly in a mood to ask either, lest they remove their support.;Strange grey dragons have come to your aid against the bearded warriors who assault your lands. They do not tell you why, or really anything at all for that matter, but you are not exactly in a mood to ask either, lest they remove their support.;Strange grey dragons have come to your aid against the bearded warriors who assault your lands. They do not tell you why, or really anything at all for that matter, but you are not exactly in a mood to ask either, lest they remove their support.;;Strange grey dragons have come to your aid against the bearded warriors who assault your lands. They do not tell you why, or really anything at all for that matter, but you are not exactly in a mood to ask either, lest they remove their support.;;;;;;;;;x;;;;;;;;;;;;;;;;;
EVTDESCDWRF.14;Seemingly from out of nowhere, grey dragons have been seen aiding Amani forces in various battles. Though they refuse to communicate, many have taken this as a sign from the Loa that defeat is unacceptable.;Seemingly from out of nowhere, grey dragons have been seen aiding our forces in various battles against the bearded invaders. Though they refuse to communicate, few are willing to question this unlikely ally.;Seemingly from out of nowhere, grey dragons have been seen aiding our forces in various battles against the bearded invaders. Though they refuse to communicate, few are willing to question this unlikely ally.;;Seemingly from out of nowhere, grey dragons have been seen aiding our forces in various battles against the bearded invaders. Though they refuse to communicate, few are willing to question this unlikely ally.;;;;;;;;;x;;;;;;;;;;;;;;;;;
EVTDESCGURUB.1;Your devotion to Hakkar, the Soulflayer, has been noted through the realm. Some, such as the priests of the Atal'ai rejoice in your piety, but more traditional trolls do not. In fact, some of them have even started refusing to call you [Root.Culture.GetName], instead calling you Hakkari.;Your devotion to Hakkar, the Soulflayer, has been noted through the realm. Some, such as the priests of the Atal'ai rejoice in your piety, but more traditional trolls do not. In fact, some of them have even started refusing to call you [Root.Culture.GetName], instead calling you Hakkari.;Your devotion to Hakkar, the Soulflayer, has been noted through the realm. Some, such as the priests of the Atal'ai rejoice in your piety, but more traditional trolls do not. In fact, some of them have even started refusing to call you [Root.Culture.GetName], instead calling you Hakkari.;;Your devotion to Hakkar, the Soulflayer, has been noted through the realm. Some, such as the priests of the Atal'ai rejoice in your piety, but more traditional trolls do not. In fact, some of them have even started refusing to call you [Root.Culture.GetName], instead calling you Hakkari.;;;;;;;;;x;;;;;;;;;;;;;;;;;
EVTOPTGURUB.1;Blood for the Blood Loa!;Blood for the Blood Loa!;Blood for the Blood Loa!;;Blood for the Blood Loa!;;;;;;;;;x;;;;;;;;;;;;;;;;;
EVTDESCGURUB.2;It appears that the gurubashi emperor has finally seen the truth the Atal'ai have known for a long time: Hakkar is the strongest of the Loa, and any who spill blood for him can also partake in this power. For years you have sacrified to other, weaker Loa for appearances, but now you can finally show your true colours!;It appears that the gurubashi emperor has finally seen the truth the Atal'ai have known for a long time: Hakkar is the strongest of the Loa, and any who spill blood for him can also partake in this power. For years you have sacrified to other, weaker Loa for appearances, but now you can finally show your true colours!;It appears that the gurubashi emperor has finally seen the truth the Atal'ai have known for a long time: Hakkar is the strongest of the Loa, and any who spill blood for him can also partake in this power. For years you have sacrified to other, weaker Loa for appearances, but now you can finally show your true colours!;;It appears that the gurubashi emperor has finally seen the truth the Atal'ai have known for a long time: Hakkar is the strongest of the Loa, and any who spill blood for him can also partake in this power. For years you have sacrified to other, weaker Loa for appearances, but now you can finally show your true colours!;;;;;;;;;x;;;;;;;;;;;;;;;;;
EVTDESCGURUB.3;Following the emperor's example, you have started calling yourself hakkari, rather than [Root.Culture.GetName], as all true followers of the Soulflayer are doing.;Following the emperor's example, you have started calling yourself hakkari, rather than [Root.Culture.GetName], as all true followers of the Soulflayer are doing.;Following the emperor's example, you have started calling yourself hakkari, rather than [Root.Culture.GetName], as all true followers of the Soulflayer are doing.;;Following the emperor's example, you have started calling yourself hakkari, rather than [Root.Culture.GetName], as all true followers of the Soulflayer are doing.;;;;;;;;;x;;;;;;;;;;;;;;;;;
EVTTITLEGURUB.4;The Gurubashi Civil War;The Gurubashi Civil War;The Gurubashi Civil War;;The Gurubashi Civil War;;;;;;;;;x;;;;;;;;;;;;;;;;;
EVTDESCGURUB.4;An envoy from far Zandalar has arrived in your court, bringing dire news. Though the priests of the Zandalari are happy that the Gurubashi have returned to their expansionism, they are worried about the rise of Hakkar's cult. The Loa of Blood, they say, will NEVER be satisfied and demand ever more blood until all life on the world is wiped out. They urge you to pick up arms against the Hakkari emperor and his Atal'ai cohorts. They promise you aid in this conflict and guarantee that the other rulers in the empire who have stayed true to the Loa will surely support you in this most holy war.;An envoy from far Zandalar has arrived in your court, bringing dire news. Though the priests of the Zandalari are happy that the Gurubashi have returned to their expansionism, they are worried about the rise of Hakkar's cult. The Loa of Blood, they say, will NEVER be satisfied and demand ever more blood until all life on the world is wiped out. They urge you to pick up arms against the Hakkari emperor and his Atal'ai cohorts. They promise you aid in this conflict and guarantee that the other rulers in the empire who have stayed true to the Loa will surely support you in this most holy war.;An envoy from far Zandalar has arrived in your court, bringing dire news. Though the priests of the Zandalari are happy that the Gurubashi have returned to their expansionism, they are worried about the rise of Hakkar's cult. The Loa of Blood, they say, will NEVER be satisfied and demand ever more blood until all life on the world is wiped out. They urge you to pick up arms against the Hakkari emperor and his Atal'ai cohorts. They promise you aid in this conflict and guarantee that the other rulers in the empire who have stayed true to the Loa will surely support you in this most holy war.;;An envoy from far Zandalar has arrived in your court, bringing dire news. Though the priests of the Zandalari are happy that the Gurubashi have returned to their expansionism, they are worried about the rise of Hakkar's cult. The Loa of Blood, they say, will NEVER be satisfied and demand ever more blood until all life on the world is wiped out. They urge you to pick up arms against the Hakkari emperor and his Atal'ai cohorts. They promise you aid in this conflict and guarantee that the other rulers in the empire who have stayed true to the Loa will surely support you in this most holy war.;;;;;;;;;x;;;;;;;;;;;;;;;;;
EVTOPTGURUB.4.a;Yes, something must be done about this.;Yes, something must be done about this.;Yes, something must be done about this.;;Yes, something must be done about this.;;;;;;;;;x;;;;;;;;;;;;;;;;;
EVTOPTGURUB.4.b;No, I cannot.;No, I cannot.;No, I cannot.;;No, I cannot.;;;;;;;;;x;;;;;;;;;;;;;;;;;
EVTDESCGURUB.5;Word reaches you that [From.GetBestName] has risen against the Hakkari emperor, and is backed by the Zandalari themselves! [From.GetSheHe] calls upon you to aid [From.GetHerHim] in this conflict.;Word reaches you that [From.GetBestName] has risen against the Hakkari emperor, and is backed by the Zandalari themselves! [From.GetSheHe] calls upon you to aid [From.GetHerHim] in this conflict.;Word reaches you that [From.GetBestName] has risen against the Hakkari emperor, and is backed by the Zandalari themselves! [From.GetSheHe] calls upon you to aid [From.GetHerHim] in this conflict.;;Word reaches you that [From.GetBestName] has risen against the Hakkari emperor, and is backed by the Zandalari themselves! [From.GetSheHe] calls upon you to aid [From.GetHerHim] in this conflict.;;;;;;;;;x;;;;;;;;;;;;;;;;;
EVTOPTGURUB.5.a;Death to the Hakkari!;Death to the Hakkari!;Death to the Hakkari!;;Death to the Hakkari!;;;;;;;;;x;;;;;;;;;;;;;;;;;
EVTDESCGURUB.6;Goaded by the weak Zandalari, [From.GetBestName] has declared open rebellion on you! They claim that you've been 'corrupted' by Hakkar and must be destroyed. But you know better. Hakkar is strong, as are all who follow him. You will spill [From.GetBestName]'s blood for the Loa of Blood, and prove his power to the world!;"Goaded by the weak Zandalari, [From.GetBestName] has declared open rebellion on you! They claim that you've been ""corrupted"" by Hakkar and must be destroyed. But you know better. Hakkar is strong, as are all who follow him. You will spill [From.GetBestName]'s blood for the Loa of Blood, and prove his power to the world!";"Goaded by the weak Zandalari, [From.GetBestName] has declared open rebellion on you! They claim that you've been ""corrupted"" by Hakkar and must be destroyed. But you know better. Hakkar is strong, as are all who follow him. You will spill [From.GetBestName]'s blood for the Loa of Blood, and prove his power to the world!";;"Goaded by the weak Zandalari, [From.GetBestName] has declared open rebellion on you! They claim that you've been ""corrupted"" by Hakkar and must be destroyed. But you know better. Hakkar is strong, as are all who follow him. You will spill [From.GetBestName]'s blood for the Loa of Blood, and prove his power to the world!";;;;;;;;;x;;;;;;;;;;;;;;;;;
EVTOPTGURUB.6;These rebels will pay!;These rebels will pay!;These rebels will pay!;;These rebels will pay!;;;;;;;;;x;;;;;;;;;;;;;;;;;
EVTDESCGURUB.7;Goaded by the weak Zandalari, [From.GetBestName] has declared open rebellion on your liege! They claim that you've been 'corrupted' by Hakkar and must be destroyed. Naturally, the emperor has responded by declaring [From.GetHerHim] a traitor and vowed that [From.GetHerHis] blood will feed the Soulflayer.;"Goaded by the weak Zandalari, [From.GetBestName] has declared open rebellion on your liege! They claim that you've been ""corrupted"" by Hakkar and must be destroyed. Naturally, the emperor has responded by declaring [From.GetHerHim] a traitor and vowed that [From.GetHerHis] blood will feed the Soulflayer.";"Goaded by the weak Zandalari, [From.GetBestName] has declared open rebellion on your liege! They claim that you've been ""corrupted"" by Hakkar and must be destroyed. Naturally, the emperor has responded by declaring [From.GetHerHim] a traitor and vowed that [From.GetHerHis] blood will feed the Soulflayer.";;"Goaded by the weak Zandalari, [From.GetBestName] has declared open rebellion on your liege! They claim that you've been ""corrupted"" by Hakkar and must be destroyed. Naturally, the emperor has responded by declaring [From.GetHerHim] a traitor and vowed that [From.GetHerHis] blood will feed the Soulflayer.";;;;;;;;;x;;;;;;;;;;;;;;;;;
EVTDESCGURUB.8;Deep in the jungles of Stranglethorn, civil war has broken out. [From.GetBestName] has, backed by the Zandalari, risen up and declared war against the emperor of Zul'Gurub, who has recently turned to the worship of Hakkar. Regardless of the outcome, this conflict may change the jungle trolls forever.;Deep in the jungles of Stranglethorn, civil war has broken out. [From.GetBestName] has, backed by the Zandalari, risen up and declared war against the emperor of Zul'Gurub, who has recently turned to the worship of Hakkar. Regardless of the outcome, this conflict may change the jungle trolls forever.;Deep in the jungles of Stranglethorn, civil war has broken out. [From.GetBestName] has, backed by the Zandalari, risen up and declared war against the emperor of Zul'Gurub, who has recently turned to the worship of Hakkar. Regardless of the outcome, this conflict may change the jungle trolls forever.;;Deep in the jungles of Stranglethorn, civil war has broken out. [From.GetBestName] has, backed by the Zandalari, risen up and declared war against the emperor of Zul'Gurub, who has recently turned to the worship of Hakkar. Regardless of the outcome, this conflict may change the jungle trolls forever.;;;;;;;;;x;;;;;;;;;;;;;;;;;
EVTOPTGURUB.8;Troubling.;Troubling.;Troubling.;;Troubling.;;;;;;;;;x;;;;;;;;;;;;;;;;;
EVTTITLEGURUB.9;Fall of the Hakkari;Fall of the Hakkari;Fall of the Hakkari;;Fall of the Hakkari;;;;;;;;;x;;;;;;;;;;;;;;;;;
EVTDESCGURUB.9;The foul Hakkari emperor has been cast down, and the threat of Hakkar being unleashed on the world appears to be no more. Though this victory also means the end of the Gurubashi empire, it was for the greater good of the world.;The foul Hakkari emperor has been cast down, and the threat of Hakkar being unleashed on the world appears to be no more. Though this victory also means the end of the Gurubashi empire, it was for the greater good of the world.;The foul Hakkari emperor has been cast down, and the threat of Hakkar being unleashed on the world appears to be no more. Though this victory also means the end of the Gurubashi empire, it was for the greater good of the world.;;The foul Hakkari emperor has been cast down, and the threat of Hakkar being unleashed on the world appears to be no more. Though this victory also means the end of the Gurubashi empire, it was for the greater good of the world.;;;;;;;;;x;;;;;;;;;;;;;;;;;
EVTOPTGURUB.9;It had to be done.;It had to be done.;It had to be done.;;It had to be done.;;;;;;;;;x;;;;;;;;;;;;;;;;;
EVTDESCGURUB.10;The gurubashi empire has fallen to rebellion, and the Hakkari have been cast down. The threat from the Soulflayer is over, at least for now.;The gurubashi empire has fallen to rebellion, and the Hakkari have been cast down. The threat from the Soulflayer is over, at least for now.;The gurubashi empire has fallen to rebellion, and the Hakkari have been cast down. The threat from the Soulflayer is over, at least for now.;;The gurubashi empire has fallen to rebellion, and the Hakkari have been cast down. The threat from the Soulflayer is over, at least for now.;;;;;;;;;x;;;;;;;;;;;;;;;;;
EVTOPTGURUB.10;Interesting.;Interesting.;Interesting.;;Interesting.;;;;;;;;;x;;;;;;;;;;;;;;;;;
EVTTITLEGURUB.12;Hakkari Triumphant;Hakkari Triumphant;Hakkari Triumphant;;Hakkari Triumphant;;;;;;;;;x;;;;;;;;;;;;;;;;;
EVTDESCGURUB.12;The traitors that sought to destroy you are now sacrifices to the great Soulflayer. Today marks the start of a new era, one where the Hakkari will show the world the power of Hakkar.;The traitors that sought to destroy you are now sacrifices to the great Soulflayer. Today marks the start of a new era, one where the Hakkari will show the world the power of Hakkar.;The traitors that sought to destroy you are now sacrifices to the great Soulflayer. Today marks the start of a new era, one where the Hakkari will show the world the power of Hakkar.;;The traitors that sought to destroy you are now sacrifices to the great Soulflayer. Today marks the start of a new era, one where the Hakkari will show the world the power of Hakkar.;;;;;;;;;x;;;;;;;;;;;;;;;;;
EVTOPTGURUB.12;The Zandalari should learn not to meddle.;The Zandalari should learn not to meddle.;The Zandalari should learn not to meddle.;;The Zandalari should learn not to meddle.;;;;;;;;;x;;;;;;;;;;;;;;;;;
EVTDESCGURUB.13;The gurubashi empire has triumphed over the rebels and the Hakkari continue in charge.;The gurubashi empire has triumphed over the rebels and the Hakkari continue in charge.;The gurubashi empire has triumphed over the rebels and the Hakkari continue in charge.;;The gurubashi empire has triumphed over the rebels and the Hakkari continue in charge.;;;;;;;;;x;;;;;;;;;;;;;;;;;
EVTTITLEGURUB.14;The Temple of Atal'Hakkar;The Temple of Atal'Hakkar;The Temple of Atal'Hakkar;;The Temple of Atal'Hakkar;;;;;;;;;x;;;;;;;;;;;;;;;;;
EVTDESCGURUB.14;Those damnable Zandalari ruined it all when they led a rebellion and deposed the glorious hakkari emperor. Yet, hope remains. The temple of Atal'Hakkar is still within your control, and from there the Soulflayer can be brought forth!;Those damnable Zandalari ruined it all when they led a rebellion and deposed the glorious hakkari emperor. Yet, hope remains. The temple of Atal'Hakkar is still within your control, and from there the Soulflayer can be brought forth!;Those damnable Zandalari ruined it all when they led a rebellion and deposed the glorious hakkari emperor. Yet, hope remains. The temple of Atal'Hakkar is still within your control, and from there the Soulflayer can be brought forth!;;Those damnable Zandalari ruined it all when they led a rebellion and deposed the glorious hakkari emperor. Yet, hope remains. The temple of Atal'Hakkar is still within your control, and from there the Soulflayer can be brought forth!;;;;;;;;;x;;;;;;;;;;;;;;;;;
EVTOPTGURUB.14.a;Yes, Hakkar will rise still!;Yes, Hakkar will rise still!;Yes, Hakkar will rise still!;;Yes, Hakkar will rise still!;;;;;;;;;x;;;;;;;;;;;;;;;;;
EVTOPTGURUB.14.b;No, we should just give up.;No, we should just give up.;No, we should just give up.;;No, we should just give up.;;;;;;;;;x;;;;;;;;;;;;;;;;;
EVTTITLEGURUB.15;Green Interlopers;Green Interlopers;Green Interlopers;;Green Interlopers;;;;;;;;;x;;;;;;;;;;;;;;;;;
EVTDESCGURUB.15;As if the rebels hadn't been enough, now green dragons have come to try and stop your holy work! This cannot be allowed! Defend the Temple and defeat these dragons!;As if the rebels hadn't been enough, now green dragons have come to try and stop your holy work! This cannot be allowed! Defend the Temple and defeat these dragons!;As if the rebels hadn't been enough, now green dragons have come to try and stop your holy work! This cannot be allowed! Defend the Temple and defeat these dragons!;;As if the rebels hadn't been enough, now green dragons have come to try and stop your holy work! This cannot be allowed! Defend the Temple and defeat these dragons!;;;;;;;;;x;;;;;;;;;;;;;;;;;
EVTOPTGURUB.15;Damn them!;Damn them!;Damn them!;;Damn them!;;;;;;;;;x;;;;;;;;;;;;;;;;;
EVTDESCGURUB.17;The meddling green dragons have been beaten back! Now you can truly prepare for the summoning!;The meddling green dragons have been beaten back! Now you can truly prepare for the summoning!;The meddling green dragons have been beaten back! Now you can truly prepare for the summoning!;;The meddling green dragons have been beaten back! Now you can truly prepare for the summoning!;;;;;;;;;x;;;;;;;;;;;;;;;;;
EVTOPTGURUB.17;Hakkar will rise!;Hakkar will rise!;Hakkar will rise!;;Hakkar will rise!;;;;;;;;;x;;;;;;;;;;;;;;;;;
EVTTITLEGURUB.18;Atal'ai Victory;Atal'ai Victory;Atal'ai Victory;;Atal'ai Victory;;;;;;;;;x;;;;;;;;;;;;;;;;;
EVTDESCGURUB.18;The trolls of the Atal'ai priesthood have managed to successfuly defend themselves against the assault of the Green Dragonflight on their temple. The consequences of this have yet to be seen, but they are bound to continue their efforts to summon their god.;The trolls of the Atal'ai priesthood have managed to successfuly defend themselves against the assault of the Green Dragonflight on their temple. The consequences of this have yet to be seen, but they are bound to continue their efforts to summon their god.;The trolls of the Atal'ai priesthood have managed to successfuly defend themselves against the assault of the Green Dragonflight on their temple. The consequences of this have yet to be seen, but they are bound to continue their efforts to summon their god.;;The trolls of the Atal'ai priesthood have managed to successfuly defend themselves against the assault of the Green Dragonflight on their temple. The consequences of this have yet to be seen, but they are bound to continue their efforts to summon their god.;;;;;;;;;x;;;;;;;;;;;;;;;;;
EVTOPTGURUB.18;Interesting.;Interesting.;Interesting.;;Interesting.;;;;;;;;;x;;;;;;;;;;;;;;;;;
